date,username,text,hashtags,mentions,retweets,favorites,to
2020-08-24 17:09:35+00:00,DMcGurty,Spent the afternoon going back over the 4 @KardiaChain articles written by the 1 &amp; only @Bankless1 This man drops knowledge! Here they are below for your entertainment $kai https://link.medium.com/dGIWRIO9i8 https://link.medium.com/TclX1jV6n8 https://medium.com/@Bankless/zero-to-one-with-kardiachain-pt-3-192901bc767a https://link.medium.com/RiJdDB0G18,,@KardiaChain @Bankless1,1,2,
2020-08-24 15:22:15+00:00,Redfox113089,"$KAI I’m excited about #kardiachain . Based in Vietnam and backed by the govt there. Next month is MainNet and it will be used by citizens to pay for taxi rides. Also, noninvasive inoperability with other blockchains. Beat that why don’t you ",#kardiachain,,0,8,girlgone_crypto
2020-08-24 14:04:01+00:00,KyleMacLeanX,"I got into these VERY early: $KAI KardiaChain $PCX ChainX $AKRO Akropolis $BZRX bZr Protocol $DMG DeFi Market $EDG Edgeware Latest picks: $CHI Xaya (up) $PAR Parachute (up) $UDOO Hyprr (sideways) I've got one more I'm accumulating, will announce this week ",,,1,27,
2020-08-24 11:59:41+00:00,IjsselsteinRoel,"$KAI is going to very soon. After a few days of accumulation, pressure is going to cause a big blast to another ATH. Make sure to step on the train for another run to new heights. @KardiaChain $btc $eth $neo $link #cryptocurrency ",#cryptocurrency,@KardiaChain,15,49,
2020-08-24 11:53:39+00:00,TheJonnyReid,"Mai Linh Group will provide KardiaChain with access to a large user base, boosting the use case for the KAI token, while KardiaChain will help Mai Linh Group gain a technological advantage. ",,,1,5,
2020-08-24 11:53:39+00:00,TheJonnyReid,"KardiaChain forms a Strategic Partnership with Mai Linh — Vietnam’s Largest Taxi Corporation ""Vietnam taxi giant Mai Linh eyes transformation into tech-based firm"" Mai Linh Group, with a charter capital of $74.71 million $Kai $link $neo $band",,,3,11,
2020-08-24 10:27:32+00:00,DopeBoiRapy, Don't know about shilling but I have huge expectations for $KAI from @KardiaChain and $BLZ from @BluzelleHQ. Hottest #blockchain projects and #altcoins out of #Asia right now.,#blockchain #altcoins #Asia,@KardiaChain @BluzelleHQ,1,1,seanybitcoins
2020-08-24 08:51:06+00:00,jonno_ukcrypto,The team at @KardiaChain have experience at some of the worlds biggest companies! Some are so valuable to these big players that they are still being kept on whilst growing the future giant that is $KAI Show me another project with so many stars! $TOMO $NEO $TRX $ETH $MITX,,@KardiaChain,23,64,
2020-08-24 06:09:20+00:00,MikeSqrrl,"Did you know you can get rich buying $KAI for only 0.029$each token? You can buy #KardiaChain at http://Kucoin.com, http://Gate.io, http://idex.market and Coinone. KAI was released only 4 months ago, true gem. Telegram: https://t.me/kardiachain $band $link",#KardiaChain,,3,13,
2020-08-24 04:16:48+00:00,MikeSqrrl,"History in the making: Next month, September 2020 $KAI, a Vietnamese cryptocurrency will be used to pay for rides for 16 000 taxis. This is huge! First step for mass adoption of #KardiaChain $xtz #Bitcoin $eth $band $link $ocean $rsr $knc $renvm $ewt $xor $dot $rlc",#KardiaChain #Bitcoin #Bitcoin,,3,17,jimmykwilson82
2020-08-24 02:24:14+00:00,TheGemFinder,"That said, lots of gems in crypto. $KAI isn't the only good option. Can't expect to catch every gem or read/understand every whitepaper. I've done my research on @KardiaChain and many projects over the years. This one stands out in terms of potential.",,@KardiaChain,0,6,
2020-08-24 00:30:55+00:00,TheGemFinder,"Watch the video to understand @KardiaChain $KAI will be used in sports, entertainment, transit. Team w/ global exp, on tech &amp; biz sides &amp; tech is unique in blockchain and crucial to business/gov. Checks all the boxes. Pre-mainnet. Bigger moves are coming. ",,@KardiaChain,0,3,TheGemFinder
2020-08-23 23:56:30+00:00,SeanMcDonnell5,Kardiachain is gonig to lead the way in interoperability and mass adoption $kai is not focusing unrealistic goals but rather focuses on small achievable goals in order to provide real world solutions Missing this will be the biggest regret of your life $link $btc $eth $matic,,,15,45,
2020-08-23 23:54:32+00:00,TheGemFinder,"Disagree. This adviser has top level experience relevant to @KardiaChain and the adoption of $KAI in many sectors of life: sports, entertainment, travel &amp; the tech is both unique to the industry and important. It's just the beginning.",,@KardiaChain,0,4,604Stever
2020-08-23 21:14:29+00:00,TFOC_,When $KAI staking @KardiaChain,,@KardiaChain,0,0,
2020-08-23 20:03:36+00:00,EdwinBurgosInc,"$Kai dual node doesn't require other #blockchains to adapt to their #interoperability. No ""upgrades"", no ""patches"", no ""migrations"" - this is just one of the features that makes @KardiaChain worth investing in. #bullish $link $eth $neo $band $ogn $matic $mitx #crypto #vietnam",#blockchains #interoperability #bullish #crypto #vietnam,@KardiaChain,6,30,IjsselsteinRoel
2020-08-23 19:54:38+00:00,IjsselsteinRoel,"The Dual Master Node of @KardiaChain provides a non-invasive way to facilitate inter-chain connection. A road to mass adoption by reducing costs and increasing speed. Interested to run a Dual Master Node? Stay tuned, Q4 will bring us so many good stuff! $KAI $BTC $NEO $ETH $TRX",,@KardiaChain,13,49,
2020-08-23 19:18:20+00:00,DMcGurty,KSML (Kardia Smart Contract Markup Language) is designed to develop smart contracts without requiring any significant experience Developers can easily employ their popular logics without having to write a single line of real code for the targeted blockchain @KardiaChain $kai ,,@KardiaChain,3,13,
2020-08-23 19:04:08+00:00,DMcGurty,"@KardiaChain Dual Master Nodes can receive transactions from external chains &amp; safely ingest those updates into $kai ledgers without compromising anything from both chains They are secure because interchain transaction data is tamper-proof, protected by a multisignature scheme ",,@KardiaChain,2,10,
2020-08-23 19:00:28+00:00,EdwinBurgosInc,@KardiaChain $Kai http://www.kardiachain.io whitepaper &gt; https://dl.kardiachain.io/KardiaChain-WhitePaper-English.pdf #bullish $link $eth $neo $band $ogn $matic $mitx #crypto #vietnam #korea #asia #japan #tokyo #usa #spain #russia #blockchain #massadoption $xdb $vet #bitcoin #crypto $xlm $trx $lcx $ocean $orn $defi,#bullish #crypto #vietnam #korea #asia #japan #tokyo #usa #spain #russia #blockchain #massadoption #bitcoin #bitcoin #crypto,@KardiaChain,1,5,
2020-08-23 18:57:56+00:00,DMcGurty,@kardiaChain is a blockchain network that connects other networks &amp; applications in the blockchain ecosystem The goal is to; create a unified ecosystem that combines the collective strength of all participants &amp; lay the foundation for the upcoming blockchain mass adoption $kai ,,@KardiaChain,0,6,
2020-08-23 18:33:17+00:00,DMcGurty,"@KardiaChain follows an “integration without assimilation” approach, which focuses on simplicity and ease-of-use The team has developed a non-invasive solution, called Dual master node to facilitate inter-chain operations among both existing &amp; upcoming blockchain platforms $kai ",,@KardiaChain,0,1,
2020-08-23 18:26:35+00:00,DMcGurty,"“The ultimate goal of KardiaChain is to create a unified ecosystem where developers can easily create smart contracts that can run on multiple blockchains in order to; optimise costs, avoid congestion &amp; allow communication in a trustless and secure manner”. $kai $btc $eth $neo",,,0,5,
2020-08-23 17:31:58+00:00,MikeSqrrl,Right now you kan buy 1$dollar for 0.028$$KAI #kardiachain $LINK $VET $XRP $ETH $BAND #Bitcoin $xlm $ocean $rsr $UBT $KNC $renvm $xor $dot,#kardiachain #Bitcoin #Bitcoin,,4,16,CodenameEnigma_
2020-08-23 16:40:41+00:00,EdwinBurgosInc,"@KardiaChain is excited to be one of the first ETH-based tokens on TronWallet! Tron Wallet has added support for more #ETH based tokens inside their new Klever wallet! New wallet support for: $KAI To learn more about Klever: Download for Android now, at ",#ETH,@KardiaChain,0,4,
2020-08-23 16:40:00+00:00,jonno_ukcrypto,Once again Don’t sleep on $KAI - Vietnamese Government has been actively supporting and pushing for industry 4.0 technological innovation - @KardiaChain Decentralised Identification (DID) is a key part of the path to #MassAdoption in #Vietnam and SE Asia #Crypto #Alts,#MassAdoption #Vietnam #Crypto #Alts,@KardiaChain,2,13,boxmining
2020-08-23 16:31:03+00:00,KJVapostol,$LCX and $KAI are top tier coins. Do you research before you say stupid things.,,,0,3,Kanavaggarwal14
2020-08-23 07:35:17+00:00,FROMKAIWITHLOVE,#KardiaChain $KAI is why you're looking for. #DYOR &amp; you'll see by yourself.,#KardiaChain #DYOR,,0,3,AltcoinDailyio
2020-08-23 06:17:10+00:00,SeanMcDonnell5,Hey man are you planning to do a follow up video with Kardiachain at all? $kai community would love it,,,0,12,Brad_Laurie
2020-08-23 05:02:36+00:00,EdwinBurgosInc,"$Kai @KardiaChain here's the whitepaper, see for yourself. https://dl.kardiachain.io/KardiaChain-WhitePaper-English.pdf",,@KardiaChain,0,7,AltcoinDailyio
2020-08-23 04:01:08+00:00,lunarcrushbot,Top Galaxy Scores™ as of Aug 22 21:01 on http://lunarcrush.com. #galaxyscore indicates the health of a coin based on social + market metrics. #BinanceCoin $BNB 79.5/100 #KardiaChain $KAI 77/100 #Constellation $DAG 77/100 #Cosmos $ATOM 76.5/100 #OMGNetwo,#galaxyscore #BinanceCoin #KardiaChain #Constellation #Cosmos #OMGNetwo,,5,11,
2020-08-23 03:52:52+00:00,crypto_adv0cate,"Here's 5 reasons to get excited about @KardiaChain &amp; $KAI All star Google Tech Team Has Non Invasive Dual-Node Cross Chain Interoperability Backed by Vietnamese Govt Partnerships with $LINK $NEO LG, GELEXIMCO and many more Mainnet to be released in Q4",,@KardiaChain,2,5,
2020-08-23 02:01:53+00:00,IAM__Network,RT Via: https://twitter.com/EdwinBurgosInc So much to like about KardiaChain $Kai . Read the Whitepaper and see for yourself. https://dl.kardiachain.io/KardiaChain-WhitePaper-English.pdf $Kai #bullish $link $eth $neo $band $ogn $matic $mitx #crypto #vietnam #korea #as,#bullish #crypto #vietnam #korea #as,,0,0,
2020-08-23 02:01:36+00:00,EdwinBurgosInc,So much to like about @KardiaChain $Kai . Read the Whitepaper and see for yourself. https://dl.kardiachain.io/KardiaChain-WhitePaper-English.pdf $Kai #bullish $link $eth $neo $band $ogn $matic $mitx #crypto #vietnam #korea #asia #japan #tokyo #usa #spain #blockchain #massadoption #bitcoin #crypto $ocean $defi,#bullish #crypto #vietnam #korea #asia #japan #tokyo #usa #spain #blockchain #massadoption #bitcoin #bitcoin #crypto,@KardiaChain,5,12,
2020-08-22 22:48:47+00:00,CwillSweet,Did you know that $Kai has a partnership with $OGN ??,,,0,1,EdwinBurgosInc
2020-08-22 22:26:04+00:00,IjsselsteinRoel,"How many transactions per second are needed for mass adoption of blockchain? That extremely high number is a challenge and @Kardiachain is the solution by connecting different blockchains together, combine their strength, make them act as a network. $KAI $NEO $TRX $ETH #crypto ",#crypto,@KardiaChain,19,53,
2020-08-22 19:40:17+00:00,setso0,Please list $kai at Binance,,,0,0,KardiaChain
2020-08-22 18:37:41+00:00,crypto_adv0cate,Big things coming in Q4. Are you excited? $KAI @KardiaChain ,,@KardiaChain,0,4,
2020-08-22 17:49:15+00:00,jonno_ukcrypto,Don’t sleep on $KAI - Vietnamese Government has been actively supporting and pushing for industry 4.0 technological innovation - @KardiaChain Decentralised Identification (DID) is a key part of the path to #MassAdoption in #Vietnam and SE Asia #Crypto #Alts #AltSeason,#MassAdoption #Vietnam #Crypto #Alts #AltSeason,@KardiaChain,3,17,boxmining
2020-08-22 17:18:21+00:00,naeimi93,$kai @KardiaChain ready to moon,,@KardiaChain,0,6,boxmining
2020-08-22 15:37:29+00:00,MikeSqrrl,"Be early! Getting in before mainnet is rare, before mass adoptions, before fomo and speculation! $KAI #KardiaChain $LINK $VET $XRP $ETH $BAND #Bitcoin $xlm",#KardiaChain #Bitcoin #Bitcoin,,4,18,FROMKAIWITHLOVE
2020-08-22 13:29:30+00:00,aramjaredvlogs,you might wanna take a look at $KAI @KardiaChain $PHNX @phnxdao $OM @MANTRADAO ,,@KardiaChain @phnxdao @MANTRADAO,0,5,thisisannsophie
2020-08-22 13:22:38+00:00,Ry_Conley,$KAI @Kardiachain $LINK $NEO $BAND $MITX $BTC $ETH #Bitcoin,#Bitcoin #Bitcoin,@KardiaChain,0,4,Bankless1
2020-08-22 12:58:11+00:00,MikeSqrrl,$kai and Vietnamese governement pushing #4ir forward with #KardiaChain $link $eth #altcoins $ubt $neo $knc $renvm $rsr $dot $xor ,#4ir #KardiaChain #altcoins,,3,16,jonno_ukcrypto
2020-08-22 12:28:18+00:00,smike1matt,"while a communist country, Vietnam is not censoring as much as China. It is open about internet and blockchain technology in particular. the Government is actively engaged You can check $KAI work and collaboration w/ the Government by simply researching, try it sometime",,,0,6,ebook4expert2
2020-08-22 12:06:19+00:00,ebook4expert2,Vietnam is a communist country and most gov officials are corrupted. One company can not thrive of they don’t bribe. So I don’t expect much about this $KAI.,,,0,1,Woodsy1983
2020-08-22 12:01:19+00:00,CryptoI75232373,$kai @KardiaChain one of my biggest holdings ,,@KardiaChain,0,4,Woodsy1983
2020-08-22 11:57:34+00:00,jonno_ukcrypto,Vietnamese Government has been actively supporting and pushing for industry 4.0 technological innovation - @KardiaChain Decentralised Identification (DID) is a key part of the path to #MassAdoption in #Vietnam and SE Asia #Crypto #Alts #AltSeason $KAI $TOMO $MITX $NEO $TRX $LINK,#MassAdoption #Vietnam #Crypto #Alts #AltSeason,@KardiaChain,32,63,
2020-08-22 10:55:18+00:00,crypto_adv0cate,Downtrend wasn't going to last forever you know. I hope you made the most of the dip because $KAI is going to the moon @KardiaChain ,,@KardiaChain,0,9,jimmykwilson82
2020-08-22 10:40:30+00:00,MikeSqrrl,#Kardiachain is non invasive and fully interoperable blockchain platform backed by the Vietnamese gov. Taxi rides getting paid with $KAI next month!,#Kardiachain,,2,11,TheCryptoLark
2020-08-22 10:28:14+00:00,AlexTScorp,"Fastest growing blockchain! You hear that?- Do your own research on $Kai and decide yourself! At this price, with a small amount you can still be a @KardiaChain @KardiachainU millionaire in a few years! Follow @Bankless1 for an intresting chat happening soon about $Kai . $LINK",,@KardiaChain @KardiachainU @Bankless1,3,10,Bankless1
2020-08-22 10:27:08+00:00,jonno_ukcrypto,"Buying $KAI as it’s en route to #massadoption with #Vietnam government backing, no legacy systems in their way and giant regional conglomerates are on board! Whether it’s transport payment or real estate.... @KardiaChain will deliver with no obstacles! NO ONE ELSE is close! ",#massadoption #Vietnam,@KardiaChain,2,10,TheCryptoLark
2020-08-22 10:16:57+00:00,jonno_ukcrypto,Look at how nicely $KAI respected the 20 day MA on the daily chart. RSI is way oversold and the last time it was these levels it 3x then 2.5x @KardiaChain on its way back up to ATH of 5c and beyond! #Crypto #Alts #Vietnam,#Crypto #Alts #Vietnam,@KardiaChain,6,11,
2020-08-22 09:51:37+00:00,DMcGurty,$kai is the moon project for you They are single-handedly revolutionising the world of blockchain KardiaChain’s patented Private-Public Blockchain Platform (PPBP) solves the biggest dilemma in blockchain adoption for institutional clients: privacy versus transparency. ,,,0,14,boxmining
2020-08-22 08:52:12+00:00,Bankless1,"The Decentralised Identity market will be worth $34bn by 2024. Kardiachain will provide this solution to both enterprise and government, saving billions in security costs and offering individuals sovereignty over their data. Just one feature of many. Real value = $kai ",,,24,62,
2020-08-22 08:40:13+00:00,safturc1,Good news $KAI ,,,1,3,KardiaChain
2020-08-22 08:04:16+00:00,lookulooku1,$KAI #Kardiachain real-life use cases... watch out for this one... #noninvasiveblockchaintech #firstofitskind,#Kardiachain #noninvasiveblockchaintech #firstofitskind,,0,2,KardiachainU
2020-08-22 07:28:33+00:00,FROMKAIWITHLOVE,"Opportunities like $KAI are rare! Getting in before Mainnet, before mass adoption, before hysterical speculation, we're riding a revolutionary wave that has only one inevitable conclusion. Hold on tight &amp; enjoy the ride, because the impact of #KardiaChain will be massive!",#KardiaChain,,4,17,
2020-08-22 04:38:52+00:00,Ry_Conley,$KAI @Kardiachain $LINK $NEO $BAND $MITX $BTC $ETH #Bitcoin,#Bitcoin #Bitcoin,@KardiaChain,2,14,IjsselsteinRoel
2020-08-22 03:00:21+00:00,imcryptohustler,4 projects and 5 coins from @Polkadot $kton $ring $ocean $akro $kai,,@Polkadot,0,2,Roma_Bitoc
2020-08-22 02:48:46+00:00,SeanMcDonnell5,"Did you know that $kai's partner Mai Linh has nearly 30,000 employees and over 16,000 cars Operates in 63 provinces Is Vietnam's largest taxi corporation And is planning to use a unique new payment card that has Kardiachain for each customer to see $icx $link $btc $eth $band",,,19,53,
2020-08-21 23:43:02+00:00,EdwardR96680947,"The last 2 times we touched 37.5 on the RSI, $KAI ran. Third time's a charm? Hopefully we get the uptick on the MACD (resets) $kai $kardiachain",,,3,23,
2020-08-21 20:18:40+00:00,MrDeFi2020,Perfect bullish falling wedge for $kai / btc on the 4hr ... getting primed for next level up .... #kardiachain on #KuCoin #gateio,#kardiachain #KuCoin #gateio,,3,14,
2020-08-21 17:09:57+00:00,Kyle18513943,"$KAI It's almost time! Ride with $KAI mass adoption take over !!! #kardiaChain is going to make so many multi millionaire's this next bull run.. Grab a bag of $KAI Don't miss this train, it won't be stopping for anyone on the way $neo $btc $link",#kardiaChain,,1,8,
2020-08-21 16:56:15+00:00,EdwinBurgosInc,"@KardiaChain $Kai Welcomes government advisor: Mr. Vuong Duy Bien - Former Deputy Minister of Culture, Sports and Tourism Read more: ",,@KardiaChain,0,1,
2020-08-21 16:39:08+00:00,DMcGurty,You already know all about @KardiaChain $kai It’s only a matter of time before the rest of the whole world catches on $kai has Non Invasive Dual-Node Cross Chain Interoperability It is the future ,,@KardiaChain,0,1,tylerlinklevoss
2020-08-21 16:25:26+00:00,EdwinBurgosInc,Can't wait to see 2 great masterminds have an educated conversation on $Kai . I'm excited,,,0,1,Bankless1
2020-08-21 15:37:42+00:00,EdwinBurgosInc,"I think most people have no clue what $Kai @KardiaChain is and how far ahead of the game they are, Just look at their partners, there's no way this token should only be .03 cents. Highly undervalued project.",,@KardiaChain,1,5,
2020-08-21 15:28:40+00:00,wyoliberty,Big on $kai. Thoughts on $rsr? Seems like it has incredible potential.,,,0,2,kyle_chasse
2020-08-21 15:01:34+00:00,fuckalota,Congrats! Best resource for $Kai right here! Send it ,,,0,2,Bankless1
2020-08-21 14:51:32+00:00,kyle_chasse,"@KardiaChain @KardiachainU and $Kai have got the government as Besties! Once they massively improve the efficiency of the entire country.... Copy and paste to many many other countries around the world, talk about Mass Adoption! @jimmykwilson82 @JohnnyZcash @TheJonnyReid",,@KardiaChain @KardiachainU @jimmykwilson82 @JohnnyZcash @TheJonnyReid,12,37,jonno_ukcrypto
2020-08-21 14:47:00+00:00,CryptoAcid,Have you been missing out on the $KAI multiple % increases? Nice buy in oppoertunity presenting itself here. I would sprinkle some buy orders in this area. #Kardiachain ,#Kardiachain,,0,1,
2020-08-21 14:40:03+00:00,aramjaredvlogs,$KAI @KardiaChain $PHNX @phnxdao $OM @MANTRADAO for sure ,,@KardiaChain @phnxdao @MANTRADAO,0,4,Crypto_Bitlord
2020-08-21 14:32:57+00:00,EdwinBurgosInc,More Incredible $Kai @KardiaChain news. Back 2 back news #bullish $link $eth $neo $band $ogn $matic $mitx #crypto #vietnam #korea #asia #japan #tokyo #usa #spain #russia #blockchain #massadoption $xdb $vet #bitcoin $xrp #crypto $xlm $dcr $trx $doge $lcx $coti $ocean $orn $defi,#bullish #crypto #vietnam #korea #asia #japan #tokyo #usa #spain #russia #blockchain #massadoption #bitcoin #bitcoin #crypto,@KardiaChain,2,2,KardiaChain
2020-08-21 14:26:40+00:00,KyleMacLeanX,Lately I've been dabbling in the dark arts of microcaps. But I remain VERY VERY VERY bullish on $KAI I refuse to chip away at my millionaire-maker bag of #KardiaChain. One of the biggest surprises of 2020 with a far better ROI than LINK thus far #Interoperability,#KardiaChain #Interoperability,,16,74,
2020-08-21 13:59:22+00:00,DMcGurty,You know it big boy! Individuals of this calibre will only help propel $kai to the next level His acquisition adds to an already blossoming team of @KardiaChain advisors Government backgrounds = government contacts! Doors will open #MassAdoption $btc $link $ogn $neo,#MassAdoption,@KardiaChain,1,8,oddgems
2020-08-21 13:53:06+00:00,IjsselsteinRoel,Combine the strength of $NEO $TRX $ETH and other blockchains. @KardiaChain allows developers to create Dapps running on different blockchains simultaneously without the need to know how to write smart contracts on those chains. $KAI #crypto #KSML,#crypto #KSML,@KardiaChain,20,50,
2020-08-21 13:33:18+00:00,MurcaryBTC,Govt level project amazing growth ahead $kai a gem!,,,0,1,oddgems
2020-08-21 13:14:43+00:00,MilesCrypto1,"Kardiachain is fast becoming the Vietnamese ICON. Strong Government connections and advisors, unbelievable tech, and some of the best partnerships in the blockchain industry. Currently only a $56m market cap and extremely undervalued. $kai $ICX $ETH $btc",,,0,1,KardiaChain
2020-08-21 12:30:35+00:00,oddgems,"$KAI @KardiaChain Former Deputy Minister of Culture, Sports and Tourism Vuong Duy Bien joined the KardiaChain Advisory Board. They're forging an amazing team, do have a look when you get time! $alts $crypto ",,@KardiaChain,16,65,KardiaChain
2020-08-21 12:12:22+00:00,Woodsy1983,Amazing news!! To integrate #blockchain technology into modern business there's no better route to take than to add government officials to the board. This opens up so many doors where other #crypto projects will fail. Well done $KAI ,#blockchain #crypto,,3,11,KardiaChain
2020-08-21 12:01:16+00:00,jonno_ukcrypto,"NEWS: @KardiaChain welcomes government advisor: Mr. Vuong Duy Bien - Former Deputy Minister of Culture, Sports and Tourism for #Vietnam The backing of Vietnamese Government current and past is invaluable. No other project in the space has this backing! $KAI $TOMO #MASSADOPTION",#Vietnam #MASSADOPTION,@KardiaChain,9,34,
2020-08-21 11:54:49+00:00,Woodsy1983,This is massive news for $KAI!!! EX government officials joining the board. We could see much faster integration of our products into #Vietnam services. Exciting times ahead for the community ,#Vietnam,,0,4,MikeSqrrl
2020-08-21 11:54:20+00:00,smike1matt,It is happening And it is happening in Vietnam and South East Asia with @KardiaChain and $KAI ,,@KardiaChain,0,2,LizBitcoin
2020-08-21 11:51:19+00:00,Ry_Conley,$KAI @Kardiachain $LINK $NEO $BAND $MITX $BTC $ETH #Bitcoin,#Bitcoin #Bitcoin,@KardiaChain,0,7,Woodsy1983
2020-08-21 11:50:50+00:00,smike1matt,Now when it comes to development and constantly innovating @KardiaChain is a step above the rest. Vietnam is actively embracing blockchain and it seems giving constant support to $KAI ,,@KardiaChain,0,4,
2020-08-21 11:50:12+00:00,MikeSqrrl,#KardiaChain is deadly serious when it comes to $KAI blockchain adoption in Vietnam and South East Asia! Unmatchable and admirable! ,#KardiaChain,,0,4,Woodsy1983
2020-08-21 11:48:59+00:00,Woodsy1983,"Former Deputy Minister of Culture, Sports and Tourism Vuong Duy Bien joined the $KAI Advisory Board. @Kardiachain means business #Crypto #btc #eth #altcoins #blockchain #xrp #etc #etn #bnb",#Crypto #btc #btc #eth #altcoins #blockchain #xrp #etc #etn #bnb #bnb,@KardiaChain,10,27,
2020-08-21 11:47:45+00:00,DMcGurty,Another step in the right direction for $kai @KardiaChain Vietnam is becoming a hot bed for blockchain development and utilisation within SE Asia $kai are at the forefront of the development drive! DYOR then come take your seat on the rocket $btc $eth $link $ogn $neo,,@KardiaChain,5,12,KardiaChain
2020-08-21 11:45:41+00:00,IjsselsteinRoel,"This is getting bigger and better. Do your research, make sure to read the doc's of Bankless on https://medium.com/@Bankless because @Kardiachain isn't joking around. $KAI $BTC $NEO $TRX #CRYPTOCURRENCY ",#CRYPTOCURRENCY,@KardiaChain,1,5,KardiaChain
2020-08-21 11:39:31+00:00,MikeSqrrl,"#KardiaChain having a government advisor in their board. He was former deputy minister of Culture, sports and Tourism. Yes #tourism. Hotell payments anybody?... $KAI is so brutal, I'ts making decent coins look like #shitcoins $link $eth $neo $band $UBT $matic #renvm",#KardiaChain #tourism #shitcoins #renvm,,3,11,KardiaChain
2020-08-21 11:37:08+00:00,Quants14,KAI client: ON Sports users use KAI tokens to: Play prediction games Donate KAI tokens to their favorite players Earn KAI tokens through various in-app tasks Win exciting rewards such as football merchandise $kai For football merchandise,,,0,0,Metro_Cargo
2020-08-21 11:35:43+00:00,AbhiMegastar,"Enterprises, government and what else you need? $KAI is going to secure multi billion dollar marketcap! @KardiaChain ",,@KardiaChain,1,3,KardiaChain
2020-08-21 11:33:54+00:00,Crypto_Nicooo,"$kai Former Deputy Minister of Culture, Sports and Tourism Vuong Duy Bien joined the KardiaChain Advisory Board ",,,0,1,
2020-08-21 11:33:32+00:00,tapascrypto,This huge $KAI #KAI @KardiaChain ,#KAI,@KardiaChain,0,5,KardiaChain
2020-08-21 11:30:11+00:00,_Max73,"This is next level news $kai Deputy Minister of Culture, Sports and Tourism Vuong Duy Bien joined the KardiaChain Advisory Board by @KardiaChain https://link.medium.com/Fdi1LmQ778",,@KardiaChain,1,2,
2020-08-21 11:27:48+00:00,fswlgkkt1,"$KAI Deputy Minister of Culture, Sports and Tourism Vuong Duy Bien joined the KardiaChain Advisory Board by @KardiaChain https://link.medium.com/Fdi1LmQ778",,@KardiaChain,0,0,
