date,username,text,hashtags,mentions,retweets,favorites,to
2020-05-31 12:41:53+00:00,CryptoDiffer,MONTHLY GAINERS LIST MAY 2020 30 Days Price Change: $KAI +336.2% $NOIA +228.3% $FSN +225.8% $BNT +168.1% $ZIL +148.1% $IOTX +125.4% $OMG +97.9% @KardiaChain @NoiaNetwork @FUSIONProtocol @Bancor @zilliqa @iotex_io @omise_go,,@KardiaChain @NoiaNetwork @FUSIONProtocol @Bancor @zilliqa @iotex_io @omise_go,17,73,
2020-05-31 12:15:40+00:00,1cryptt,$KAI #KardiaChain Hi Kardians! The transcript for Gate &lt;&gt; KardiaChain Livestream AMA on 28th May has been published! You can check more here: ,#KardiaChain,,1,3,
2020-05-31 10:37:53+00:00,1cryptt,"$KAI KardiaChain - A real undervalued project https://www.reddit.com/r/CryptoMoonShots/comments/gtn39g/kardiachain_a_real_undervalued_project/ Tired of seeing this subreddit flooded with PnD crypto scams with no real team,value or product.",,,1,6,
2020-05-31 07:42:52+00:00,ivivere,"10 most promising projects according to this analysis, $kai is one of them #kardiachain ",#kardiachain,,0,3,
2020-05-31 06:58:13+00:00,1cryptt,"If you have any inquiry / concerns about $KAI #KardiaChain, you can ask official Telegram here. https://t.me/kardiachain Team is reliable &amp; you can get clear answer from team. Don't be fooled &amp; believe ridiculous FUD. Official Q&amp;A Twitter Channel will be open soon.",#KardiaChain,,0,6,
2020-05-31 06:31:42+00:00,1cryptt,$KAI #KardiaChain will be listed on Kyber soon? https://twitter.com/1cryptt/status/1266692930221117441,#KardiaChain,,0,7,
2020-05-31 02:52:22+00:00,1cryptt,"3/ $KAI #KardiaChain However, each solution has its strength and weakness. In term of adoption though, I strongly believe if KAI can achieve our goal of bringing 1-100M people to the blockchain, we could be very valuable.",#KardiaChain,,0,3,
2020-05-31 02:52:21+00:00,1cryptt,2/ $KAI #KardiaChain I’d say Cosmos is one of the most respectable project out there and we learnt a lot from them.,#KardiaChain,,0,4,
2020-05-31 02:52:21+00:00,1cryptt,"1/ $KAI #KardiaChain Haha let me tell you an interesting story, our US tech team once bumped into Jae Kwon (Cosmos CEO) in a restaurant in San Francisco. We had a very engaging conversation about tech and blockchain in general. ",#KardiaChain,,3,7,
2020-05-31 02:46:33+00:00,1cryptt,"$KAI / about Eric Hung Nguyen, CFA Mr.Hung is no longer CFO/Chairman. Of course he still remains an investor, friend, and in our board of founding member. He wants to pursue new opportunities in Vietnam after 2 years in #KardiaChain. ",#KardiaChain,,0,1,
2020-05-31 00:50:06+00:00,satsnetwork,"In this picture, replace the word #cat with $KAI ... People work really hard on FUDing coins they are actually interested in so they can buy cheap. Hold steady with @KardiaChain and don’t be the cat in the picture. $KAI IS A GREAT PROJECT. – at Poppa Rollos",#cat,@KardiaChain,1,8,
2020-05-30 23:44:22+00:00,dont_FOMO,Check out and share! $KAI @KardiaChain 100X #moonshot #gem,#moonshot #gem,@KardiaChain,5,29,
2020-05-30 22:53:31+00:00,1cryptt,"7/ $KAI #KardiaChain As such, Mr. Ho will play a pivotal role in bringing KardiaChain’s cutting-edge blockchain technology to the Vietnamese transportation industry. Bringing us one stop closer to our mission of on-boarding 100 million Vietnamese people on blockchain.",#KardiaChain,,0,6,
2020-05-30 22:53:30+00:00,1cryptt,"6/ $KAI #KardiaChain With his vast experience, knowledge and business network over the past 31 years, Mr. Ho will be an invaluable addition to KardiaChain’s advisory board.",#KardiaChain,,0,3,
2020-05-30 22:53:29+00:00,1cryptt,"5/ $KAI #KardiaChain With the aim to gain valuable knowledge and experience, as well as expand our business network, we have on-boarded a very reputable figure in the Vietnamese business world — Mr. Ho Huy. ",#KardiaChain,,0,3,
2020-05-30 22:53:28+00:00,1cryptt,"4/ $KAI #KardiaChain KardiaChain’s enterprise connections in Vietnam are far-reaching, yet we continue to expand into major industries.",#KardiaChain,,0,3,
2020-05-30 22:53:26+00:00,1cryptt,"3/ $KAI #KardiaChain KardiaChain welcomes a new Advisor — Hồ Huy, Chairman of Mai Linh Corporation - the top Taxi and Transportation Operator in Vietnam https://medium.com/kardiachain/kardiachain-welcomes-a-new-advisor-h%E1%BB%93-huy-chairman-of-mai-linh-corporation-the-top-taxi-and-8026ac85d6f7",#KardiaChain,,0,3,
2020-05-30 22:53:26+00:00,1cryptt,"2/ $KAI #KardiaChain The technology could be used as an important platform to build smart cities and to manage education, certificate administration, financial transactions, healthcare and business administration. ",#KardiaChain,,0,2,
2020-05-30 22:53:25+00:00,1cryptt,1/ $KAI #KardiaChain The system built by KardiaChain Foundation Ltd also allows users to have direct interactions with goods and service suppliers across the world. http://bizhub.vn/tech/vietnamese-start-up-builds-multi-connection-blockchain-system_304136.html,#KardiaChain,,2,8,
2020-05-30 21:58:33+00:00,CryptoOakShield,bought some more before next leg up $kai,,,0,3,dont_FOMO
2020-05-30 21:56:37+00:00,CryptoOakShield,KardiaChain - The First Decentralized Interoperable and Self-Optimised Blockchain Ecosystem + KardiaChain provides the infrastructure for Dapps to exchange data and interact with each other securely and seamlessly + Study whitepaper https://dl.kardiachain.io/KardiaChain-WhitePaper-English.pdf $kai $qnt $ubt $idex,,,2,12,
2020-05-30 21:22:56+00:00,rgr_park,Looks like a bearish retest and a case of support flipping into resistance on $kai #kardiachain. Definitely would not enter here and would be praying hard if I were holding. ,#kardiachain,,0,1,TwoSatsWorth
2020-05-30 19:57:20+00:00,_Max73,"""From the analysis company @CryptoRank_io, #Solana, #ARPA, #Proton, #Quarkchain, #Troy, #Aergo, #VITE, #KardiaChain, #FLETA and #INTChain are projects with a bright future in the field of #cryptocurrency"" https://www.europeworldnews.com/a-look-back-at-the-10-most-promising-projects-with-low-market-capitalization/ $kai",#Solana #ARPA #Proton #Quarkchain #Troy #Aergo #VITE #KardiaChain #FLETA #INTChain #cryptocurrency,@CryptoRank_io,1,16,
2020-05-30 19:03:59+00:00,dont_FOMO,Kardiachain has been featured in this article by Europe World News Featured as one of 10 Most Promising #blockchain projects with less than a $10M #marketcap! Very good read and analysis! @KardiaChain $KAI #blockchain #technology #dapps https://www.europeworldnews.com/a-look-back-at-the-10-most-promising-projects-with-low-market-capitalization/,#blockchain #marketcap #blockchain #technology #dapps,@KardiaChain,18,39,
2020-05-30 18:48:17+00:00,dont_FOMO,Had our first major retrace on $KAI @KardiaChain. Support is building and it looks like we're about to head back up! May be a good time to #BTFD and join the next leg! #crypto #blockchain #HODL on to your hat!,#BTFD #crypto #blockchain #HODL,@KardiaChain,4,24,
2020-05-30 18:30:40+00:00,CryptooBirb,$Kai @KardiaChain has been featured https://www.europeworldnews.com/a-look-back-at-the-10-most-promising-projects-with-low-market-capitalization/ #bitcoin #cryptocurrency #DeFi #blockchain,#bitcoin #bitcoin #cryptocurrency #DeFi #blockchain,@KardiaChain,4,17,
2020-05-30 14:04:03+00:00,ShslabyM,"It only takes $KAI 1M$to drop or surge 30%. Again volatility is such a normal thing in a low MC coin. Smart people don’t panic knowing that you only need $KAI at 35M MC to make 10x from here. That being said, I personally think that $KAI will hit 100M. Not financial advice!",,,1,18,TwoSatsWorth
2020-05-30 12:44:34+00:00,TwoSatsWorth,"Did you get shaken out by the blatant false $KAI FUD ? The team has been developing @KardiaChain for years now and has ties with $MATIC, $BAND, $COS, $VITE in crypto and the likes of LG, large telecom and government outside I haven't sold a cent &amp; I'm as confident as ever ",,@KardiaChain,21,71,
2020-05-30 12:30:13+00:00,CryptoOakShield,Imagine buying $neo $ltc $iota while $LCX and $KAI is there @lcx @KardiaChain ,,@lcx @KardiaChain,0,3,
2020-05-30 12:26:47+00:00,sscrypto2018,"$KAI - @KardiaChain Looks like a small MC gem growing fast. New parternerships, new listings happenong really fast. Nice retrace on price tooo right now. $LCX $LINK $XTZ $UBT $RSR $VRA $ETH #BITCOIN #BTC",#BITCOIN #BITCOIN #BTC #BTC,@KardiaChain,1,3,
2020-05-30 12:26:29+00:00,MurcaryBTC,$kai @KardiaChain buy the dip! #BTC $VID $VIDT $VRA,#BTC #BTC,@KardiaChain,0,2,
2020-05-30 12:18:49+00:00,rgr_park,"Yes I'm salty I missed the 10X, but you can always recognize when a coin is dumping (bagholders quotes) because they will mention ""long-term"" and ""adding to cold storage."" No one's in crypto for long-term gains. $kai #kardiachain ",#kardiachain,,0,0,CryptoOakShield
2020-05-30 10:18:36+00:00,1cryptt,"$KAI #KardiaChain Official "" Lock &amp; Earn"" program is not announced yet &amp; we don't know what the annual interest rate is. And Hotbit investment product's interest is very high &amp; that reminds me FCoin... I'm afraid someday they couldn't pay interest then...",#KardiaChain,,0,4,
2020-05-30 10:15:20+00:00,dCryptoRepublic,Just loaded up on Kardiachain $KAI after a nice retrace! $BTC $ETH $XRP,,,0,3,
2020-05-30 08:25:28+00:00,1cryptt,Strategic Partnership with $KAI #KardiaChain &amp; $TRX will support KaidiaChain’s interop tech.,#KardiaChain,,3,14,justinsuntron
2020-05-30 06:47:10+00:00,1cryptt,"If you have any question or doubt about $KAI #KardiaChain, you can ask official Twitter or Telegram before you fooled. DYOR &amp; don’t believe 4chan or any FUD. ",#KardiaChain,,3,3,GemStoneEmpress
2020-05-30 06:16:18+00:00,Going4ward,I have big bag of $KAI @KardiaChain Potential is crazy. What they did and planing to do this project deserve to be in top50 of CMC in near future And here is why: ,,@KardiaChain,0,3,
2020-05-30 04:41:26+00:00,ShslabyM,Get $KAI @KardiaChain listed,,@KardiaChain,1,7,kucoincom
2020-05-30 02:25:46+00:00,Going4ward,Honestly I really like what you guys do for all crypto space. @TheCryptoLark @Brad_Laurie Appreciate your hard work. But you should look at this project @KardiaChain $KAI So many big things going on and what they are trying to deliver ,,@TheCryptoLark @Brad_Laurie @KardiaChain,2,9,Crypto_Nolt
2020-05-29 23:54:03+00:00,CryptoOakShield,$KAI is the future,,,1,5,_Max73
2020-05-29 23:50:58+00:00,Bitosher,"I never shill one coin, but $KAI is real Gem. Gem of the Gems! In next 2-4 month we can expect x20- x30 from price it is now. DYOR @KardiaChain or drive with Toyota Prius. Nothing.. NOTHING .. is worst as Prius. $BTC $ETH $Link $XRP $LCX $EDI",,@KardiaChain,3,13,
2020-05-29 23:45:59+00:00,MagicAslan,LG CNS partnered with @KardiaChain to white-label their tech and gain exposure to the Vietnam market. LG CNS has its own blockchain brand named MonaChain! KardiaChain $KAI has been recently listed on @Gate_io! Article link,,@KardiaChain @gate_io,2,6,
2020-05-29 21:54:06+00:00,Bitosher,This will fly like a Space X. @KardiaChain No.1 of the LowCap Gems. This can go parabolic to 100-200 MM $MarketCap. Not advice..just DYOR. If you will miss this.. than better to delete your crypto account. $theta $tfuel $btc $eth $matic $vet $ADA $KAI $matic $EDI $lcx $tel $xrp,,@KardiaChain,6,19,
2020-05-29 21:47:33+00:00,Tadashi_Satoh,#KardiaChain $KAI is the most exciting project in crypto right now #kai #crypto $crypto #cryptocurrency #btc #bitcoin $btc $eth #ethereum #eth #idex #exchange,#KardiaChain #kai #crypto #cryptocurrency #btc #btc #bitcoin #bitcoin #ethereum #eth #idex #exchange,,7,11,BandAdventurer
2020-05-29 21:42:47+00:00,_Max73,"Just a quick reminder: 【 $KAI 】KardiaChain IEO Raised：19,201,190 USDT Goal：1,080,000 USDT ",,,4,10,
2020-05-29 21:33:57+00:00,2011_btc,$KAI + STRONG HANDS = GENERATIONAL WEALTH #kardiachain #idex #exchange #btc #eth #crypto #altcoins,#kardiachain #idex #exchange #btc #btc #eth #crypto #altcoins,,7,8,cryptoturk06
2020-05-29 20:17:24+00:00,IAM__Network,"RT Via: https://twitter.com/crypto_nolt $KAI ama KardiaChain “Mobile payment gateway in collaboration with Vietnam’s top telecom with over 80,000,000 across 10 countries, who will all be able to acquire KAI tokens using their",,,9,22,
2020-05-29 19:43:54+00:00,Crypto_Nolt,"$KAI ama @KardiaChain “Mobile payment gateway in collaboration with Vietnam’s top telecom with over 80,000,000 across 10 countries, who will all be able to acquire KAI tokens using their mobile balance” $BTC $ETH #Bitcoin #cryptocurrency $XRP $NEO $ADA $EOS $XTZ $LCX $MATIC https://twitter.com/juxtheposition/status/1266433530906791937",#Bitcoin #Bitcoin #cryptocurrency,@KardiaChain,21,44,
2020-05-29 15:59:08+00:00,BandAdventurer,"Like what I've seen of the @KardiaChain mgmt team. Professional, down to earth, getting things done. Their partnerships with large enterprise and Vietnamese government can bring massive adoption soon. $KAI $BAND $LCX $MATIC $NANO",,@KardiaChain,2,13,_Max73
2020-05-29 15:52:45+00:00,Suzhou_China,How to: 1) Buy $KAI 2) Forget about it 3) Be VERY happily surprised in 5 years! Looking at prices 10x a day won't do you any good!,,,6,16,_Max73
2020-05-29 15:12:08+00:00,Cryptonighted,All I can say is by the dip! $kai,,,0,13,_Max73
2020-05-29 15:00:34+00:00,JohnnyBlank,thanks for clearing this up! Very excited to see where $kai goes from here.,,,0,6,_Max73
2020-05-29 14:52:47+00:00,_Max73,About the little fud about $kai here is the official answer by @KardiaChain @hunykardia.,,@KardiaChain @hunykardia,9,38,
2020-05-29 14:22:06+00:00,CKopeinig,The Next big guy is in the House $Kai @KardiaChain $kava $hbar $coti $neo $Band $eth $theta $matic $cos $icx $iost $bat $algo $nano,,@KardiaChain,9,14,KardiaChain
2020-05-29 14:20:52+00:00,HashSpike,Wasn't everyone into $KAI for a P&amp;D?,,,0,1,crypto_go_
2020-05-29 14:19:24+00:00,b2pLes,Just picked up some $KAI Thanks @KyleMacLeanX #DYOR #KardiaChain ,#DYOR #KardiaChain,@KyleMacLeanX,0,9,
2020-05-29 14:07:10+00:00,LegitoCrypto,You mean the idex whale who received nearly 500million $KAI 50 days ago from the Team Wallet and started to sell off? ,,,0,2,_Max73
2020-05-29 14:05:51+00:00,CryptooBirb,"New listing : KAI/USDT trading pair at 18:30 on May 29, 2020 (UTC+8) Deposit &amp; Withdrawal: Opened Total supply: 5,000,000,000 KAI More details: https://support.hoo.com/hc/en-us/articles/900001084606 @HooExchange $Kai @KardiaChain #bitcoin #cryptocurrency",#bitcoin #bitcoin #cryptocurrency,@HooExchange @KardiaChain,7,10,
2020-05-29 14:01:06+00:00,lawrenzoosei,@KardiaChain $KAI $FUND $COTI $CHR with staking,,@KardiaChain,0,8,TheGemHunters
2020-05-29 12:40:33+00:00,dont_FOMO,"""Getting $KAI into the hands of every Vietnamese citizen"" Chairman of Mai Linh, the leading Taxi company in Vietnam. Everyday @kardiachain has been blasting out explosive updates! Announced today! #KAI will be trading on @HooExchange, a $315M+ daily volume #crypto exchange! ",#KAI #crypto,@KardiaChain @HooExchange,24,48,KardiaChain
2020-05-29 12:32:31+00:00,ctbutt114,"Are they? Because no $KAI has moved from that wallet in 2 weeks, and if you do the math, there's actually 250M MORE in there than what circulating supply is (wallet has 3.75B, reported circulating is 1.5B, meaning team has rebought 250M, no?).",,,0,4,crypto_go_
2020-05-29 12:11:50+00:00,RenDeHero,$KAI Wait for it ,,,0,1,RenDeHero
2020-05-29 12:07:17+00:00,KyleMacLeanX,"Nice little healthy pullback on KardiaChain $KAI if you want to get in. Provides interoperability between $ETH $MATIC $NEO $TRX $BAND etc. Partnered with LG this week. After 5Xing, it's pulled back 30% but should bounce back up nicely. Longterm hold for me #KardiaChain ",#KardiaChain,,24,67,
2020-05-29 12:05:34+00:00,mrwilburwonka,"@CryptoNewton hello, what do you think of kardiachain $kai",,@CryptoNewton,0,6,
2020-05-29 11:39:40+00:00,CryptooBirb,$Kai @KardiaChain awesome news ,,@KardiaChain,6,10,
2020-05-29 11:31:23+00:00,Crypto_Nolt,Great !! $KAI Partnerships with big companies will rain ! The @KardiaChain team is killing it !,,@KardiaChain,6,13,crypto_snack
2020-05-29 11:20:52+00:00,Cryptokk12,"For me the same, got banned by Crypto Snack for telling the truth that the team is selling tokens $KAI #kardiachain ",#kardiachain,,0,4,crypto_go_
2020-05-29 11:16:37+00:00,crypto_go_,"$KAI @Kardiachain team doing a PnD. 70% up then 40% down Look at the flow of their wallet. Was banned when questioned this in the ""KAI unofficial trading tg."" https://etherscan.io/token/0xbd6467a31899590474ce1e84f70594c53d628e46?a=0x14191195f9bb6e54465a341cec6cce4491599ccc @crypto_snack was in there bossing the PnD. I Got out at profit - others will get smashed.",,@KardiaChain @crypto_snack,0,12,
2020-05-29 10:45:21+00:00,CryptoOakShield,"$kai @KardiaChain bringing even more heat! ""KardiaChain welcomes a new Advisor — Hồ Huy, Chairman of Mai Linh Corporation - the top Taxi and Transportation Operator in Vietnam"" $band $matic $neo $eth $btc $xio $dxd $xrp $trb",,@KardiaChain,7,8,whalepoon
2020-05-29 10:35:01+00:00,CryptoOakShield,Good to see the growth at $KAI,,,7,8,KardiaChain
2020-05-29 10:23:46+00:00,crypto_snack,The $KAI team is just delivering more big news from week to week and shows how strongly they are connected to really strong advisors and partners they are taking over Vietnam completely and other Crypto projects want to join KardiaChain to get some of the country. ,,,24,54,KardiaChain
2020-05-29 10:17:02+00:00,AbhiMegastar,"Now you know what's coming! It's HUGEEE!! LG CNS, Vietnamese network carrier giant Viettel and now top Taxi and Transportation Operator Mai Linh Corporation. #MorePowerToKai $KAI @KardiaChain ",#MorePowerToKai,@KardiaChain,8,11,KardiaChain
2020-05-29 10:09:32+00:00,_Max73,Regarding the new @KardiaChain advisor I would say than soon in Vietnam you will be able to pay a taxi course with $kai imo.,,@KardiaChain,0,9,
2020-05-29 10:08:12+00:00,Going4ward,It’s getting bigger. Buy the dip guys! $KAI @KardiaChain ,,@KardiaChain,9,18,
2020-05-29 10:06:32+00:00,_Max73,"""As such, Mr. Ho will play a pivotal role in bringing KardiaChain’s cutting-edge blockchain technology to the Vietnamese transportation industry. Bringing us one stop closer to our mission of on-boarding 100 million Vietnamese people on #blockchain."" $kai @KardiaChain",#blockchain,@KardiaChain,2,8,
2020-05-29 10:01:16+00:00,whalepoon,"$kai @KardiaChain bringing even more heat! ""KardiaChain welcomes a new Advisor — Hồ Huy, Chairman of Mai Linh Corporation - the top Taxi and Transportation Operator in Vietnam"" $band $matic $neo $eth $btc $xio $dxd $xrp $trb",,@KardiaChain,10,17,
2020-05-29 10:00:07+00:00,_Max73,"KardiaChain welcomes a new Advisor — Hồ Huy, Chairman of Mai Linh Corporation - the top Taxi and… by @KardiaChain https://link.medium.com/eMj4JJEBS6. Again this is huge $kai",,@KardiaChain,6,10,
2020-05-29 09:24:08+00:00,markleegeek,"$KAI Kardiachain 101 Check out this Interview of Hung Nguyen last May 11, 2019 by @Brad_Laurie Blockchain of Blockchains | BlockchainBrad | Dual Node | ESWIM | BFT dPOS",,@Brad_Laurie,6,11,
2020-05-29 07:07:49+00:00,Sentti_official,Fully agree mate! So bullish on $QNT and $KAI both. Quant is strong in Europe and Kardiachain in Asia but both are and will be more global solutions in the future!,,,1,5,marwolwarl
2020-05-29 04:57:19+00:00,Hotbit_news,"Hotbit listed the KAI @KardiaChain investment product on May 29th Rate of Annualized Return 24.77%(calculated in compound interest) , with a redemption period of T+1 Go to deposit $KAI https://hotbit.io/dw/deposit?symbol=KAI Details ",,@KardiaChain,10,35,
2020-05-29 04:28:30+00:00,1cryptt,"$KAI #KardiaChain When #Bithumb ? &amp; other Korean exchange? We need Korean exchange &amp; deserve to listing, we have strong Partnership with LG CNS. I'm looking forward to @KardiaChain change profile like this in the near future. ",#KardiaChain #Bithumb,@KardiaChain,2,8,
2020-05-28 22:55:03+00:00,BandAdventurer,"$KAI has excellent token utility, and buybacks on top of that, Wow! Thx for the reminder.",,,4,6,Going4ward
2020-05-28 22:54:26+00:00,2011_btc,"#KardiaChain $KAI is going to be huge. 1,000x potential #kai #idex #crypto $crypto #cryptocurrency $esh #esh #ghost $ghost $anj #anj $xio #xio $xgm $defis #defis $ubt #ubt $xdce #xdce $lcx #lcx $stake $btc $eth #bitcoin #btc #ethereum #eth",#KardiaChain #kai #idex #crypto #cryptocurrency #esh #ghost #anj #xio #defis #ubt #xdce #lcx #bitcoin #bitcoin #btc #btc #ethereum #eth,,2,6,juxtheposition
2020-05-28 22:50:08+00:00,Tadashi_Satoh,#KardiaChain $KAI is the most exciting project in crypto right now #kai #crypto $crypto #cryptocurrency #btc #bitcoin $btc $eth #ethereum #eth #idex #exchange,#KardiaChain #kai #crypto #cryptocurrency #btc #btc #bitcoin #bitcoin #ethereum #eth #idex #exchange,,6,13,BandAdventurer
2020-05-28 22:31:38+00:00,jpenney72,#KardiaChain is going to mint more millionaires than #Ethereum did $kai #eth #idex #crypto $crypto #btc $btc #bitcoin #esh $esh #xgm $xgm $xio #xio #lcx $lcx #ubt $ubt $band #band $matic #matic $neo #neo,#KardiaChain #Ethereum #eth #idex #crypto #btc #btc #bitcoin #bitcoin #esh #xgm #xio #lcx #ubt #band #matic #neo,,2,7,KardiaChain
2020-05-28 22:26:12+00:00,LarryAWarden,Put on your astronaut suit and buckle up because $KAI is going to the moon! #kardiachain #kai #idex #crypto $crypto #cryptocurrency $esh #esh #ghost $ghost $anj #anj $xio #xio $xgm $defis #defis $ubt #ubt $xdce #xdce $lcx #lcx $stake $btc $eth #bitcoin #btc #ethereum #eth,#kardiachain #kai #idex #crypto #cryptocurrency #esh #ghost #anj #xio #defis #ubt #xdce #lcx #bitcoin #bitcoin #btc #btc #ethereum #eth,,8,11,xviaripple
2020-05-28 22:19:19+00:00,2011_btc,$KAI + STRONG HANDS = GENERATIONAL WEALTH #kardiachain #idex #exchange #btc #eth #crypto #altcoins,#kardiachain #idex #exchange #btc #btc #eth #crypto #altcoins,,4,10,
2020-05-28 22:09:13+00:00,2011_btc,#KardiaChain $KAI will be top 20 on CoinMarketCap soon #crypto #blockchain #btc #eth #idex,#KardiaChain #crypto #blockchain #btc #btc #eth #idex,,6,8,xviaripple
2020-05-28 21:50:16+00:00,RichardBGibbs,#KardiaChain $KAI is going straight to $100m marketcap #crypto $crypto #cryptocurrency #blockchain #tech #bitcoin #btc $btc #ethereum $eth #eth $ghost #ghost #xio $xio $frm #frm #xgm $xgm $dxdao #dxdao #xaya $xaya #hai $hai #vxv $vxv #lcx $lcx,#KardiaChain #crypto #cryptocurrency #blockchain #tech #bitcoin #bitcoin #btc #btc #ethereum #eth #ghost #xio #frm #xgm #dxdao #xaya #hai #vxv #lcx,,6,13,marwolwarl
2020-05-28 21:32:45+00:00,BandAdventurer,"Kardiachain is poised for mass adoption by 100 million Vietnamese, for mobile payments and other uses. It has government backing, big enterprise partnerships, little competition and a market cap of only $5 million. Don't sleep on this opportunity! $KAI ",,,1,2,KardiaChain
2020-05-28 19:50:35+00:00,CryptoOakShield,"Hi Team @KardiaChain, Excellent team and developments. Can you add the $KAI logo and social profile, also price and marketcap need to be updated! https://etherscan.io/token/0xbd6467a31899590474ce1e84f70594c53d628e46",,@KardiaChain,0,3,
2020-05-28 19:19:51+00:00,CryptoFlatout,Yep go go go $KAI ,,,6,7,aramjaredvlogs
2020-05-28 19:18:39+00:00,1cryptt,$KAI #KardiaChain Q. Is football the sport No.1 in Vietnam? A. Yes it is man. They love it ,#KardiaChain,,0,1,
2020-05-28 19:18:39+00:00,1cryptt,"$KAI #KardiaChain Their football league also back to normal last week already with so much football fan came to stadium to see, they are crazy about football, another fact to expect about KardiaChain",#KardiaChain,,6,7,
2020-05-28 19:18:38+00:00,1cryptt,"$KAI #KardiaChain Just a fact, as we can see so much potential with the link up between Kardiachain and Vietnamese Government",#KardiaChain,,6,7,
2020-05-28 19:18:38+00:00,1cryptt,"$KAI #KardiaChain Fact: Vietnam has gone more than a month without new case of Convid - 19. So far, I can say Vietnam has won that Convid war. Vietnam's economy is expecting to grow from now on, as other big countries is struggling with virus. ",#KardiaChain,,7,10,
2020-05-28 19:09:37+00:00,1cryptt,"$KAI #KardiaChain Vietnam’s Largest Telecoms Company Enters Blockchain Sphere, Aims to Be Industry Leader https://cointelegraph.com/news/vietnams-largest-telecoms-company-enters-blockchain-sphere-aims-to-be-industry-leader The Viettel Enterprise Solutions Corporation is a development and innovation wing of Vietnam’s largest telecommunications operator Viettel Group.",#KardiaChain,,6,13,
2020-05-28 18:59:39+00:00,aramjaredvlogs,Who else is all in for $KAI? this ,,,6,9,KardiaChain
2020-05-28 18:45:30+00:00,aramjaredvlogs,i might not be in the top 20 but i'm a proud $KAI Holder i can only hope for a free merch tbh ,,,0,2,KardiaChain
2020-05-28 18:39:33+00:00,smike1matt,Nice to hear from the @KuCoinModerator It would be good if the $KAI community could help draw your attention to our desire to trade @KardiaChain on @kucoincom. Hopefully you can come to some kind of professional agreement that is not financially demanding,,@KuCoinModerator @KardiaChain @kucoincom,6,15,KuCoinModerator
2020-05-28 18:29:05+00:00,CryptoOakShield,Please consider listing @kucoincom @KardiaChain $kai,,@kucoincom @KardiaChain,7,12,TheJonnyReid
2020-05-28 18:16:32+00:00,TwoSatsWorth,You can have your view and I'll have mine. I could spend all day looking for ways to degrade other projects but I'd rather find ones that will make me money such as $KAI. I will take profit when there is liquidity to do so. That time is not yet but it will come.,,,7,11,RenDeHero
2020-05-28 18:12:30+00:00,CKopeinig,I feel with you bro . Transfered mine to MEW today. Hodl that Supergem $Kai,,,6,8,TwoSatsWorth
2020-05-28 18:12:01+00:00,RenDeHero,"80k$of KAI could dump you to 0,0016 again hahah, is it worth? to hold a token that is promoted like this ?",,,0,0,CKopeinig
2020-05-28 18:03:18+00:00,CKopeinig,"This picture won’t end well, but he get Rekt well because he isn’t in $kai ",,,0,3,RenDeHero
